name,description,HDR[DRSOUTID],file type,suffix,fibers,dbname,dbkey,input file
FF_FLAT,Flat calibration file,FF_FLAT,.fits,_flat,"AB, A, B, C",calibration,FLAT,FLAT_FLAT
FF_BLAZE,Blaze calibration file,FF_BLAZE,.fits,_blaze,"AB, A, B, C",calibration,BLAZE,FLAT_FLAT
EXT_E2DS_LL,Pre-extracted straighted stacked spectrum,EXT_E2DS_LL,.fits,_e2dsll,"AB, A, B, C",--,--,"DRS_PP, FLAT_FLAT"
ORDERP_STRAIGHT,Straightened order profile for an individual image,ORDERP_STRAIGHT,.fits,_orderps,"AB, A, B, C",--,--,SHAPEL
DEBUG_BACK,Individual file background map,DEBUG_BACK,.fits,_background.fits,--,--,--,DRS_PP
