name,description,HDR[DRSOUTID],file type,suffix,fibers,dbname,dbkey,input file
LOC_ORDERP,Localisation: Order profile calibration file,LOC_ORDERP,.fits,_order_profile,"AB, C",calibration,ORDER_PROFILE,"FLAT_DARK, DARK_FLAT"
LOC_LOCO,Localisation: Position polynomial calibration file,LOC_LOCO,.fits,_loco,"AB, C",calibration,LOC,"FLAT_DARK, DARK_FLAT"
LOC_FWHM,Localisation: Width polynomial calibration file,LOC_FWHM,.fits,_fwhm-order,"AB, C",--,--,"FLAT_DARK, DARK_FLAT"
LOC_SUP,Localisation: Position superpositionimage calibration file,LOC_SUP,.fits,_with-order,"AB, C",--,--,"FLAT_DARK, DARK_FLAT"
DEBUG_BACK,Individual file background map,DEBUG_BACK,.fits,_background.fits,--,--,--,DRS_PP
