name,description,HDR[DRSOUTID],file type,suffix,fibers,dbname,dbkey,input file
EXT_E2DS_FF,Extracted + flat-fielded 2D spectrum,EXT_E2DS_FF,.fits,_e2dsff,"AB, A, B, C",--,--,DRS_PP
WAVESOL_REF,Reference wavelength solution calibration file,WAVESOL_REF,.fits,_wavesol_ref,"AB, A, B, C",calibration,WAVESOL_REF,"EXT_E2DS, EXT_E2DS_FF"
WAVEREF_CAV,Reference wavelength cavity width polynomial calibration file,WAVEREF_CAV,.fits,_waveref_cav_,AB,calibration,WAVECAV,"EXT_E2DS, EXT_E2DS_FF"
WAVE_HCLIST_REF,Reference list of Hollow cathode lines calibration file,WAVE_HCLIST_REF,.fits,_waveref_hclines,"AB, A, B, C",calibration,WAVEHCL,"EXT_E2DS, EXT_E2DS_FF"
WAVE_FPLIST_REF,Reference list of FP liens calibration file,WAVE_FPLIST_REF,.fits,_waveref_fplines,"AB, A, B, C",calibration,WAVEFPL,"EXT_E2DS, EXT_E2DS_FF"
WAVERES,Reference wavelength resolution map file,WAVE_RES,.fits,_waveref_resmap,"AB, A, B, C",--,--,"EXT_E2DS, EXT_E2DS_FF"
CCF_RV,Cross-correlation RV results file,CCF_RV,.fits,_ccf,"AB, A, B, C",--,--,"EXT_E2DS_FF, TELLU_OBJ"
